ID,content,author,likes,shares,date-time,main_post_id
20582,Come and meet us at Building 14 of RMIT.,SD2C45,10,24,12/05/2023 10:10,0
10,Check out this epic film.,A567VF,1000,1587,1/06/2023 14:25,0
37221,Are we into Christmas month already?!,3827F2,526,25,15/11/2022 23:30,0
382,What a miracle!,38726I,2775,13589,12/02/2023 18:18,0
36778,Fantastic day today. Congratulations to all winners.,1258XE,230,1214,6/06/2023 21:00,0
11,Oh what movie is it? Is it good?,ABC123,103,2765,1/08/2023 14:25,10
12,I just watched Barbie. It is so PINK!,A567VF,2501,9050,2/08/2023 12:15,10
20600,"Ok I will see you there, what coffees you want?",1258XE,5,1,12/05/2023 10:30,20582